,movie_year,movie,year,rating,vote_count,genres,director,stars,runtime,description,movie_url,poster_url,created_at,family,fantasy,biography,romance,musical,sport,sci-fi,action,crime,horror,adventure,history,western,animation,comedy,drama,thriller,film-noir,mystery,war,music,title_link,combined_features
231,Kahaani (2012),Kahaani,2012,8.1,61115,Mystery Thriller,Sujoy Ghosh,Vidya Balan Parambrata Chattopadhyay Indraneil Sengupta Nawazuddin Siddiqui,122,"A pregnant woman's search for her missing husband takes her from London to Kolkata, but everyone she questions denies having ever met him.",https://www.imdb.com//title/tt1821480/,"https://m.media-amazon.com/images/M/MV5BMTQ1NDI0NzkyOF5BMl5BanBnXkFtZTcwNzAyNzE2Nw@@._V1_UY98_CR0,0,67,98_AL_.jpg",2021-12-16T06:03:30.283081+00:00,0,0,0,0,0,0,0,0,0,0,0,0,0,0,0,0,1,0,1,0,0,[Kahaani (2012)](https://www.imdb.com//title/tt1821480/),"Mystery ThrillerA pregnant woman's search for her missing husband takes her from London to Kolkata, but everyone she questions denies having ever met him.Vidya Balan Parambrata Chattopadhyay Indraneil Sengupta Nawazuddin SiddiquiSujoy Ghosh"
232,Prisoners (2013),Prisoners,2013,8.1,651421,Crime Drama Mystery,Denis Villeneuve,Hugh Jackman Jake Gyllenhaal Viola Davis Melissa Leo,153,"When Keller Dover's daughter and her friend go missing, he takes matters into his own hands as the police pursue multiple leads and the pressure mounts.",https://www.imdb.com//title/tt1392214/,"https://m.media-amazon.com/images/M/MV5BMTg0NTIzMjQ1NV5BMl5BanBnXkFtZTcwNDc3MzM5OQ@@._V1_UX67_CR0,0,67,98_AL_.jpg",2021-12-16T06:03:30.283081+00:00,0,0,0,0,0,0,0,0,1,0,0,0,0,0,0,1,0,0,1,0,0,[Prisoners (2013)](https://www.imdb.com//title/tt1392214/),"Crime Drama MysteryWhen Keller Dover's daughter and her friend go missing, he takes matters into his own hands as the police pursue multiple leads and the pressure mounts.Hugh Jackman Jake Gyllenhaal Viola Davis Melissa LeoDenis Villeneuve"
233,Mad Max: Fury Road (2015),Mad Max: Fury Road,2015,8.1,941380,Action Adventure Sci-Fi,George Miller,Tom Hardy Charlize Theron Nicholas Hoult Zoë Kravitz,120,"In a post-apocalyptic wasteland, a woman rebels against a tyrannical ruler in search for her homeland with the aid of a group of female prisoners, a psychotic worshiper, and a drifter named Max.",https://www.imdb.com//title/tt1392190/,"https://m.media-amazon.com/images/M/MV5BN2EwM2I5OWMtMGQyMi00Zjg1LWJkNTctZTdjYTA4OGUwZjMyXkEyXkFqcGdeQXVyMTMxODk2OTU@._V1_UX67_CR0,0,67,98_AL_.jpg",2021-12-16T06:03:30.283081+00:00,0,0,0,0,0,0,1,1,0,0,1,0,0,0,0,0,0,0,0,0,0,[Mad Max: Fury Road (2015)](https://www.imdb.com//title/tt1392190/),"Action Adventure Sci-FiIn a post-apocalyptic wasteland, a woman rebels against a tyrannical ruler in search for her homeland with the aid of a group of female prisoners, a psychotic worshiper, and a drifter named Max.Tom Hardy Charlize Theron Nicholas Hoult Zoë KravitzGeorge Miller"
234,Warrior (2011),Warrior,2011,8.1,453739,Action Drama Sport,Gavin O'Connor,Tom Hardy Nick Nolte Joel Edgerton Jennifer Morrison,140,"The youngest son of an alcoholic former boxer returns home, where he's trained by his father for competition in a mixed martial arts tournament - a path that puts the fighter on a collision course with his estranged, older brother.",https://www.imdb.com//title/tt1291584/,"https://m.media-amazon.com/images/M/MV5BMTk4ODk5MTMyNV5BMl5BanBnXkFtZTcwMDMyNTg0Ng@@._V1_UX67_CR0,0,67,98_AL_.jpg",2021-12-16T06:03:30.283081+00:00,0,0,0,0,0,1,0,1,0,0,0,0,0,0,0,1,0,0,0,0,0,[Warrior (2011)](https://www.imdb.com//title/tt1291584/),"Action Drama SportThe youngest son of an alcoholic former boxer returns home, where he's trained by his father for competition in a mixed martial arts tournament - a path that puts the fighter on a collision course with his estranged, older brother.Tom Hardy Nick Nolte Joel Edgerton Jennifer MorrisonGavin O'Connor"
235,A Wednesday (2008),A Wednesday,2008,8.1,76880,Action Crime Drama,Neeraj Pandey,Anupam Kher Naseeruddin Shah Virendra Saxena Mahesh Kanual,104,A retiring police officer reminisces about the most astounding day of his career. About a case that was never filed but continues to haunt him in his memories - the case of a man and a Wednesday.,https://www.imdb.com//title/tt1280558/,"https://m.media-amazon.com/images/M/MV5BOTcwMzdiMWItMjZlOS00MzAzLTg5OTItNTA4OGYyMjBhMmRiXkEyXkFqcGdeQXVyODE5NzE3OTE@._V1_UY98_CR1,0,67,98_AL_.jpg",2021-12-16T06:03:30.283081+00:00,0,0,0,0,0,0,0,1,1,0,0,0,0,0,0,1,0,0,0,0,0,[A Wednesday (2008)](https://www.imdb.com//title/tt1280558/),Action Crime DramaA retiring police officer reminisces about the most astounding day of his career. About a case that was never filed but continues to haunt him in his memories - the case of a man and a Wednesday.Anupam Kher Naseeruddin Shah Virendra Saxena Mahesh KanualNeeraj Pandey
236,Zack Snyder's Justice League (2021),Zack Snyder's Justice League,2021,8.1,349464,Action Adventure Fantasy,Zack Snyder,Henry Cavill Ben Affleck Gal Gadot Amy Adams,242,"Determined to ensure Superman's ultimate sacrifice was not in vain, Bruce Wayne aligns forces with Diana Prince with plans to recruit a team of metahumans to protect the world from an approaching threat of catastrophic proportions.",https://www.imdb.com//title/tt12361974/,"https://m.media-amazon.com/images/M/MV5BYjI3NDg0ZTEtMDEwYS00YWMyLThjYjktMTNlM2NmYjc1OGRiXkEyXkFqcGdeQXVyMTEyMjM2NDc2._V1_UX67_CR0,0,67,98_AL_.jpg",2021-12-16T06:03:30.283081+00:00,0,1,0,0,0,0,0,1,0,0,1,0,0,0,0,0,0,0,0,0,0,[Zack Snyder's Justice League (2021)](https://www.imdb.com//title/tt12361974/),"Action Adventure FantasyDetermined to ensure Superman's ultimate sacrifice was not in vain, Bruce Wayne aligns forces with Diana Prince with plans to recruit a team of metahumans to protect the world from an approaching threat of catastrophic proportions.Henry Cavill Ben Affleck Gal Gadot Amy AdamsZack Snyder"
237,Gran Torino (2008),Gran Torino,2008,8.1,748448,Drama,Clint Eastwood,Clint Eastwood Bee Vang Christopher Carley Ahney Her,116,"Disgruntled Korean War veteran Walt Kowalski sets out to reform his neighbor, Thao Lor, a Hmong teenager who tried to steal Kowalski's prized possession: a 1972 Gran Torino.",https://www.imdb.com//title/tt1205489/,"https://m.media-amazon.com/images/M/MV5BMTc5NTk2OTU1Nl5BMl5BanBnXkFtZTcwMDc3NjAwMg@@._V1_UX67_CR0,0,67,98_AL_.jpg",2021-12-16T06:03:30.283081+00:00,0,0,0,0,0,0,0,0,0,0,0,0,0,0,0,1,0,0,0,0,0,[Gran Torino (2008)](https://www.imdb.com//title/tt1205489/),"DramaDisgruntled Korean War veteran Walt Kowalski sets out to reform his neighbor, Thao Lor, a Hmong teenager who tried to steal Kowalski's prized possession: a 1972 Gran Torino.Clint Eastwood Bee Vang Christopher Carley Ahney HerClint Eastwood"
238,Harry Potter and the Deathly Hallows: Part 2 (2011),Harry Potter and the Deathly Hallows: Part 2,2011,8.1,814877,Adventure Fantasy Mystery,David Yates,Daniel Radcliffe Emma Watson Rupert Grint Michael Gambon,130,"Harry, Ron, and Hermione search for Voldemort's remaining Horcruxes in their effort to destroy the Dark Lord as the final battle rages on at Hogwarts.",https://www.imdb.com//title/tt1201607/,"https://m.media-amazon.com/images/M/MV5BMGVmMWNiMDktYjQ0Mi00MWIxLTk0N2UtN2ZlYTdkN2IzNDNlXkEyXkFqcGdeQXVyODE5NzE3OTE@._V1_UX67_CR0,0,67,98_AL_.jpg",2021-12-16T06:03:30.283081+00:00,0,1,0,0,0,0,0,0,0,0,1,0,0,0,0,0,0,0,1,0,0,[Harry Potter and the Deathly Hallows: Part 2 (2011)](https://www.imdb.com//title/tt1201607/),"Adventure Fantasy MysteryHarry, Ron, and Hermione search for Voldemort's remaining Horcruxes in their effort to destroy the Dark Lord as the final battle rages on at Hogwarts.Daniel Radcliffe Emma Watson Rupert Grint Michael GambonDavid Yates"
239,Departures (2008),Departures,2008,8.1,50821,Drama Music,Yôjirô Takita,Masahiro Motoki Ryôko Hirosue Tsutomu Yamazaki Kazuko Yoshiyuki,130,A newly unemployed cellist takes a job preparing the dead for funerals.,https://www.imdb.com//title/tt1069238/,"https://m.media-amazon.com/images/M/MV5BMTUzOTcwOTA2NV5BMl5BanBnXkFtZTcwNDczMzczMg@@._V1_UY98_CR0,0,67,98_AL_.jpg",2021-12-16T06:03:30.283081+00:00,0,0,0,0,0,0,0,0,0,0,0,0,0,0,0,1,0,0,0,0,1,[Departures (2008)](https://www.imdb.com//title/tt1069238/),Drama MusicA newly unemployed cellist takes a job preparing the dead for funerals.Masahiro Motoki Ryôko Hirosue Tsutomu Yamazaki Kazuko YoshiyukiYôjirô Takita
240,CODA (2021),CODA,2021,8.1,27486,Drama Music,Sian Heder,Emilia Jones Marlee Matlin Troy Kotsur Daniel Durant,111,"As a CODA (Child of Deaf Adults) Ruby is the only hearing person in her deaf family. When the family's fishing business is threatened, Ruby finds herself torn between pursuing her love of music by wanting to go to Berkeley and her fear of abandoning her parents.",https://www.imdb.com//title/tt10366460/,"https://m.media-amazon.com/images/M/MV5BNGNmMzJjMTItODA0OC00ZWM0LWJmMTctMDg3MzM2M2Y5NTIyXkEyXkFqcGdeQXVyMDM2NDM2MQ@@._V1_UX67_CR0,0,67,98_AL_.jpg",2021-12-16T06:03:30.283081+00:00,0,0,0,0,0,0,0,0,0,0,0,0,0,0,0,1,0,0,0,0,1,[CODA (2021)](https://www.imdb.com//title/tt10366460/),"Drama MusicAs a CODA (Child of Deaf Adults) Ruby is the only hearing person in her deaf family. When the family's fishing business is threatened, Ruby finds herself torn between pursuing her love of music by wanting to go to Berkeley and her fear of abandoning her parents.Emilia Jones Marlee Matlin Troy Kotsur Daniel DurantSian Heder"
241,Hachi: A Dog's Tale (2009),Hachi: A Dog's Tale,2009,8.1,269869,Biography Drama Family,Lasse Hallström,Richard Gere Joan Allen Cary-Hiroyuki Tagawa Sarah Roemer,93,A college professor bonds with an abandoned dog he takes into his home.,https://www.imdb.com//title/tt1028532/,"https://m.media-amazon.com/images/M/MV5BNzE4NDg5OWMtMzg3NC00ZDRjLTllMDMtZTRjNWZmNjBmMGZlXkEyXkFqcGdeQXVyMTMxODk2OTU@._V1_UY98_CR1,0,67,98_AL_.jpg",2021-12-16T06:03:30.283081+00:00,1,0,1,0,0,0,0,0,0,0,0,0,0,0,0,1,0,0,0,0,0,[Hachi: A Dog's Tale (2009)](https://www.imdb.com//title/tt1028532/),Biography Drama FamilyA college professor bonds with an abandoned dog he takes into his home.Richard Gere Joan Allen Cary-Hiroyuki Tagawa Sarah RoemerLasse Hallström
242,Mary and Max (2009),Mary and Max,2009,8.1,172078,Animation Comedy Drama,Adam Elliot,Toni Collette Philip Seymour Hoffman Eric Bana Barry Humphries,92,"A tale of friendship between two unlikely pen pals: Mary, a lonely, eight-year-old girl living in the suburbs of Melbourne, and Max, a forty-four-year old, severely obese man living in New York.",https://www.imdb.com//title/tt0978762/,"https://m.media-amazon.com/images/M/MV5BMDgzYjQwMDMtNGUzYi00MTRmLWIyMGMtNjE1OGZkNzY2YWIzL2ltYWdlXkEyXkFqcGdeQXVyNjU0OTQ0OTY@._V1_UY98_CR1,0,67,98_AL_.jpg",2021-12-16T06:03:30.283081+00:00,0,0,0,0,0,0,0,0,0,0,0,0,0,1,1,1,0,0,0,0,0,[Mary and Max (2009)](https://www.imdb.com//title/tt0978762/),"Animation Comedy DramaA tale of friendship between two unlikely pen pals: Mary, a lonely, eight-year-old girl living in the suburbs of Melbourne, and Max, a forty-four-year old, severely obese man living in New York.Toni Collette Philip Seymour Hoffman Eric Bana Barry HumphriesAdam Elliot"
243,25th Hour (2002),25th Hour,2002,7.6,175589,Drama,Spike Lee,Edward Norton Barry Pepper Philip Seymour Hoffman Rosario Dawson,135,"Cornered by the DEA, convicted New York drug dealer Montgomery Brogan reevaluates his life in the 24 remaining hours before facing a seven-year jail term.",https://www.imdb.com//title/tt0307901/,"https://m.media-amazon.com/images/M/MV5BNmE0YjdlYTktMTU4Ni00Mjk2LWI3NWMtM2RjNmFiOTk4YjYxL2ltYWdlXkEyXkFqcGdeQXVyNTAyODkwOQ@@._V1_UY98_CR1,0,67,98_AL_.jpg",2021-12-16T06:03:30.283081+00:00,0,0,0,0,0,0,0,0,0,0,0,0,0,0,0,1,0,0,0,0,0,[25th Hour (2002)](https://www.imdb.com//title/tt0307901/),"DramaCornered by the DEA, convicted New York drug dealer Montgomery Brogan reevaluates his life in the 24 remaining hours before facing a seven-year jail term.Edward Norton Barry Pepper Philip Seymour Hoffman Rosario DawsonSpike Lee"
244,How to Train Your Dragon (2010),How to Train Your Dragon,2010,8.1,701310,Animation Action Adventure,Dean DeBlois,Chris Sanders Jay Baruchel Gerard Butler Christopher Mintz-Plasse Craig Ferguson,98,"A hapless young Viking who aspires to hunt dragons becomes the unlikely friend of a young dragon himself, and learns there may be more to the creatures than he assumed.",https://www.imdb.com//title/tt0892769/,"https://m.media-amazon.com/images/M/MV5BMjA5NDQyMjc2NF5BMl5BanBnXkFtZTcwMjg5ODcyMw@@._V1_UX67_CR0,0,67,98_AL_.jpg",2021-12-16T06:03:30.283081+00:00,0,0,0,0,0,0,0,1,0,0,1,0,0,1,0,0,0,0,0,0,0,[How to Train Your Dragon (2010)](https://www.imdb.com//title/tt0892769/),"Animation Action AdventureA hapless young Viking who aspires to hunt dragons becomes the unlikely friend of a young dragon himself, and learns there may be more to the creatures than he assumed.Chris Sanders Jay Baruchel Gerard Butler Christopher Mintz-Plasse Craig FergusonDean DeBlois"
245,Into the Wild (2007),Into the Wild,2007,8.1,600204,Adventure Biography Drama,Sean Penn,Emile Hirsch Vince Vaughn Catherine Keener Marcia Gay Harden,148,"After graduating from Emory University, top student and athlete Christopher McCandless abandons his possessions, gives his entire $24,000 savings account to charity and hitchhikes to Alaska to live in the wilderness. Along the way, Christopher encounters a series of characters that shape his life.",https://www.imdb.com//title/tt0758758/,"https://m.media-amazon.com/images/M/MV5BMTAwNDEyODU1MjheQTJeQWpwZ15BbWU2MDc3NDQwNw@@._V1_UX67_CR0,0,67,98_AL_.jpg",2021-12-16T06:03:30.283081+00:00,0,0,1,0,0,0,0,0,0,0,1,0,0,0,0,1,0,0,0,0,0,[Into the Wild (2007)](https://www.imdb.com//title/tt0758758/),"Adventure Biography DramaAfter graduating from Emory University, top student and athlete Christopher McCandless abandons his possessions, gives his entire $24,000 savings account to charity and hitchhikes to Alaska to live in the wilderness. Along the way, Christopher encounters a series of characters that shape his life.Emile Hirsch Vince Vaughn Catherine Keener Marcia Gay HardenSean Penn"
246,No Country for Old Men (2007),No Country for Old Men,2007,8.1,913982,Crime Drama Thriller,Ethan Coen,Joel Coen Tommy Lee Jones Javier Bardem Josh Brolin Woody Harrelson,122,Violence and mayhem ensue after a hunter stumbles upon a drug deal gone wrong and more than two million dollars in cash near the Rio Grande.,https://www.imdb.com//title/tt0477348/,"https://m.media-amazon.com/images/M/MV5BMjA5Njk3MjM4OV5BMl5BanBnXkFtZTcwMTc5MTE1MQ@@._V1_UX67_CR0,0,67,98_AL_.jpg",2021-12-16T06:03:30.283081+00:00,0,0,0,0,0,0,0,0,1,0,0,0,0,0,0,1,1,0,0,0,0,[No Country for Old Men (2007)](https://www.imdb.com//title/tt0477348/),Crime Drama ThrillerViolence and mayhem ensue after a hunter stumbles upon a drug deal gone wrong and more than two million dollars in cash near the Rio Grande.Joel Coen Tommy Lee Jones Javier Bardem Josh Brolin Woody HarrelsonEthan Coen
247,"Carry On, Munna Bhai (2006)","Carry On, Munna Bhai",2006,8.1,45634,Comedy Drama Romance,Rajkumar Hirani,Sanjay Dutt Arshad Warsi Vidya Balan Boman Irani,144,Munna Bhai embarks on a journey with Mahatma Gandhi in order to fight against a corrupt property dealer.,https://www.imdb.com//title/tt0456144/,"https://m.media-amazon.com/images/M/MV5BN2ZmMDMwODgtMzA5MS00MGU0LWEyYTgtYzQ5MmQzMzU2NTVkXkEyXkFqcGdeQXVyODE5NzE3OTE@._V1_UY98_CR0,0,67,98_AL_.jpg",2021-12-16T06:03:30.283081+00:00,0,0,0,1,0,0,0,0,0,0,0,0,0,0,1,1,0,0,0,0,0,"[Carry On, Munna Bhai (2006)](https://www.imdb.com//title/tt0456144/)",Comedy Drama RomanceMunna Bhai embarks on a journey with Mahatma Gandhi in order to fight against a corrupt property dealer.Sanjay Dutt Arshad Warsi Vidya Balan Boman IraniRajkumar Hirani
248,V for Vendetta (2005),V for Vendetta,2005,8.1,1078419,Action Drama Sci-Fi,James McTeigue,Hugo Weaving Natalie Portman Rupert Graves Stephen Rea,132,"In a future British tyranny, a shadowy freedom fighter, known only by the alias of ""V,"" plots to overthrow it with the help of a young woman.",https://www.imdb.com//title/tt0434409/,"https://m.media-amazon.com/images/M/MV5BOTI5ODc3NzExNV5BMl5BanBnXkFtZTcwNzYxNzQzMw@@._V1_UX67_CR0,0,67,98_AL_.jpg",2021-12-16T06:03:30.283081+00:00,0,0,0,0,0,0,1,1,0,0,0,0,0,0,0,1,0,0,0,0,0,[V for Vendetta (2005)](https://www.imdb.com//title/tt0434409/),"Action Drama Sci-FiIn a future British tyranny, a shadowy freedom fighter, known only by the alias of ""V,"" plots to overthrow it with the help of a young woman.Hugo Weaving Natalie Portman Rupert Graves Stephen ReaJames McTeigue"
249,Nobody Knows (2004),Nobody Knows,2004,8.1,26715,Drama,Hirokazu Koreeda,Yûya Yagira Ayu Kitaura Hiei Kimura Momoko Shimizu,141,"In a small Tokyo apartment, twelve-year-old Akira must care for his younger siblings after their mother leaves them and shows no sign of returning.",https://www.imdb.com//title/tt0408664/,"https://m.media-amazon.com/images/M/MV5BNjAwMjIzZjctNzA5NC00NGM2LTgwM2UtYjUwNGI5YWZiNDJjXkEyXkFqcGdeQXVyMzAxNjg3MjQ@._V1_UX67_CR0,0,67,98_AL_.jpg",2021-12-16T06:03:30.283081+00:00,0,0,0,0,0,0,0,0,0,0,0,0,0,0,0,1,0,0,0,0,0,[Nobody Knows (2004)](https://www.imdb.com//title/tt0408664/),"DramaIn a small Tokyo apartment, twelve-year-old Akira must care for his younger siblings after their mother leaves them and shows no sign of returning.Yûya Yagira Ayu Kitaura Hiei Kimura Momoko ShimizuHirokazu Koreeda"
250,Rang De Basanti (2006),Rang De Basanti,2006,8.1,117085,Comedy Crime Drama,Rakeysh Omprakash Mehra,Aamir Khan Soha Ali Khan Siddharth Sharman Joshi,167,"The story of six young Indians who assist an English woman to film a documentary on the freedom fighters from their past, and the events that lead them to relive the long-forgotten saga of freedom.",https://www.imdb.com//title/tt0405508/,"https://m.media-amazon.com/images/M/MV5BYThmZDA0YmQtMWJhNy00MDQwLTk0Y2YtMDhmZTE5ZjhlNjliXkEyXkFqcGdeQXVyODE5NzE3OTE@._V1_UY98_CR1,0,67,98_AL_.jpg",2021-12-16T06:03:30.283081+00:00,0,0,0,0,0,0,0,0,1,0,0,0,0,0,1,1,0,0,0,0,0,[Rang De Basanti (2006)](https://www.imdb.com//title/tt0405508/),"Comedy Crime DramaThe story of six young Indians who assist an English woman to film a documentary on the freedom fighters from their past, and the events that lead them to relive the long-forgotten saga of freedom.Aamir Khan Soha Ali Khan Siddharth Sharman JoshiRakeysh Omprakash Mehra"
251,Million Dollar Baby (2004),Million Dollar Baby,2004,8.1,663256,Drama Sport,Clint Eastwood,Hilary Swank Clint Eastwood Morgan Freeman Jay Baruchel,132,A determined woman works with a hardened boxing trainer to become a professional.,https://www.imdb.com//title/tt0405159/,"https://m.media-amazon.com/images/M/MV5BMTkxNzA1NDQxOV5BMl5BanBnXkFtZTcwNTkyMTIzMw@@._V1_UX67_CR0,0,67,98_AL_.jpg",2021-12-16T06:03:30.283081+00:00,0,0,0,0,0,1,0,0,0,0,0,0,0,0,0,1,0,0,0,0,0,[Million Dollar Baby (2004)](https://www.imdb.com//title/tt0405159/),Drama SportA determined woman works with a hardened boxing trainer to become a professional.Hilary Swank Clint Eastwood Morgan Freeman Jay BaruchelClint Eastwood
252,Hotel Rwanda (2004),Hotel Rwanda,2004,8.1,345999,Biography Drama History,Terry George,Don Cheadle Sophie Okonedo Joaquin Phoenix Xolani Mali,121,"Paul Rusesabagina, a hotel manager, houses over a thousand Tutsi refugees during their struggle against the Hutu militia in Rwanda, Africa.",https://www.imdb.com//title/tt0395169/,"https://m.media-amazon.com/images/M/MV5BZGJjYmIzZmQtNWE4Yy00ZGVmLWJkZGEtMzUzNmQ4ZWFlMjRhXkEyXkFqcGdeQXVyMTMxODk2OTU@._V1_UX67_CR0,0,67,98_AL_.jpg",2021-12-16T06:03:30.283081+00:00,0,0,1,0,0,0,0,0,0,0,0,1,0,0,0,1,0,0,0,0,0,[Hotel Rwanda (2004)](https://www.imdb.com//title/tt0395169/),"Biography Drama HistoryPaul Rusesabagina, a hotel manager, houses over a thousand Tutsi refugees during their struggle against the Hutu militia in Rwanda, Africa.Don Cheadle Sophie Okonedo Joaquin Phoenix Xolani MaliTerry George"
253,Before Sunset (2004),Before Sunset,2004,8.1,250854,Drama Romance,Richard Linklater,Ethan Hawke Julie Delpy Vernon Dobtcheff Louise Lemoine Torrès,80,"Nine years after Jesse and Celine first met, they encounter each other again on the French leg of Jesse's book tour.",https://www.imdb.com//title/tt0381681/,"https://m.media-amazon.com/images/M/MV5BMTQ1MjAwNTM5Ml5BMl5BanBnXkFtZTYwNDM0MTc3._V1_UX67_CR0,0,67,98_AL_.jpg",2021-12-16T06:03:30.283081+00:00,0,0,0,1,0,0,0,0,0,0,0,0,0,0,0,1,0,0,0,0,0,[Before Sunset (2004)](https://www.imdb.com//title/tt0381681/),"Drama RomanceNine years after Jesse and Celine first met, they encounter each other again on the French leg of Jesse's book tour.Ethan Hawke Julie Delpy Vernon Dobtcheff Louise Lemoine TorrèsRichard Linklater"
254,Munna Bhai M.B.B.S. (2003),Munna Bhai M.B.B.S.,2003,8.1,78671,Comedy Drama,Rajkumar Hirani,Sanjay Dutt Arshad Warsi Gracy Singh Boman Irani,156,A gangster sets out to fulfill his father's dream of becoming a doctor.,https://www.imdb.com//title/tt0374887/,"https://m.media-amazon.com/images/M/MV5BMzQ4MTBlYTQtMzJkYS00OGNjLTk1MWYtNzQ0OTQ0OWEyOWU1XkEyXkFqcGdeQXVyNDgyODgxNjE@._V1_UY98_CR1,0,67,98_AL_.jpg",2021-12-16T06:03:30.283081+00:00,0,0,0,0,0,0,0,0,0,0,0,0,0,0,1,1,0,0,0,0,0,[Munna Bhai M.B.B.S. (2003)](https://www.imdb.com//title/tt0374887/),Comedy DramaA gangster sets out to fulfill his father's dream of becoming a doctor.Sanjay Dutt Arshad Warsi Gracy Singh Boman IraniRajkumar Hirani
255,Memories of Murder (2003),Memories of Murder,2003,8.1,163761,Crime Drama Mystery,Bong Joon Ho,Kang-ho Song Kim Sang-kyung Roe-ha Kim Jae-ho Song,132,"In a small Korean province in 1986, two detectives struggle with the case of multiple young women being found raped and murdered by an unknown culprit.",https://www.imdb.com//title/tt0353969/,"https://m.media-amazon.com/images/M/MV5BOGViNTg4YTktYTQ2Ni00MTU0LTk2NWUtMTI4OTc1YTM0NzQ2XkEyXkFqcGdeQXVyMDM2NDM2MQ@@._V1_UX67_CR0,0,67,98_AL_.jpg",2021-12-16T06:03:30.283081+00:00,0,0,0,0,0,0,0,0,1,0,0,0,0,0,0,1,0,0,1,0,0,[Memories of Murder (2003)](https://www.imdb.com//title/tt0353969/),"Crime Drama MysteryIn a small Korean province in 1986, two detectives struggle with the case of multiple young women being found raped and murdered by an unknown culprit.Kang-ho Song Kim Sang-kyung Roe-ha Kim Jae-ho SongBong Joon Ho"
256,Dil Chahta Hai (2001),Dil Chahta Hai,2001,8.1,70204,Comedy Drama Romance,Farhan Akhtar,Aamir Khan Saif Ali Khan Akshaye Khanna Preity Zinta,183,"Three inseparable childhood friends are just out of college. Nothing comes between them - until they each fall in love, and their wildly different approaches to relationships creates tension.",https://www.imdb.com//title/tt0292490/,"https://m.media-amazon.com/images/M/MV5BMjRjMTYwMTYtMmRkNi00MmVkLWE0MjQtNmM3YjI0NWFhZDNmXkEyXkFqcGdeQXVyODE5NzE3OTE@._V1_UX67_CR0,0,67,98_AL_.jpg",2021-12-16T06:03:30.283081+00:00,0,0,0,1,0,0,0,0,0,0,0,0,0,0,1,1,0,0,0,0,0,[Dil Chahta Hai (2001)](https://www.imdb.com//title/tt0292490/),"Comedy Drama RomanceThree inseparable childhood friends are just out of college. Nothing comes between them - until they each fall in love, and their wildly different approaches to relationships creates tension.Aamir Khan Saif Ali Khan Akshaye Khanna Preity ZintaFarhan Akhtar"
257,Kill Bill: Vol. 1 (2003),Kill Bill: Vol. 1,2003,8.1,1058573,Action Crime Drama,Quentin Tarantino,Uma Thurman David Carradine Daryl Hannah Michael Madsen,111,"After awakening from a four-year coma, a former assassin wreaks vengeance on the team of assassins who betrayed her.",https://www.imdb.com//title/tt0266697/,"https://m.media-amazon.com/images/M/MV5BNzM3NDFhYTAtYmU5Mi00NGRmLTljYjgtMDkyODQ4MjNkMGY2XkEyXkFqcGdeQXVyNzkwMjQ5NzM@._V1_UX67_CR0,0,67,98_AL_.jpg",2021-12-16T06:03:30.283081+00:00,0,0,0,0,0,0,0,1,1,0,0,0,0,0,0,1,0,0,0,0,0,[Kill Bill: Vol. 1 (2003)](https://www.imdb.com//title/tt0266697/),"Action Crime DramaAfter awakening from a four-year coma, a former assassin wreaks vengeance on the team of assassins who betrayed her.Uma Thurman David Carradine Daryl Hannah Michael MadsenQuentin Tarantino"
258,Finding Nemo (2003),Finding Nemo,2003,8.1,993790,Animation Adventure Comedy,Andrew Stanton,Lee Unkrich Albert Brooks Ellen DeGeneres Alexander Gould Willem Dafoe,100,"After his son is captured in the Great Barrier Reef and taken to Sydney, a timid clownfish sets out on a journey to bring him home.",https://www.imdb.com//title/tt0266543/,"https://m.media-amazon.com/images/M/MV5BZTAzNWZlNmUtZDEzYi00ZjA5LWIwYjEtZGM1NWE1MjE4YWRhXkEyXkFqcGdeQXVyNjU0OTQ0OTY@._V1_UX67_CR0,0,67,98_AL_.jpg",2021-12-16T06:03:30.283081+00:00,0,0,0,0,0,0,0,0,0,0,1,0,0,1,1,0,0,0,0,0,0,[Finding Nemo (2003)](https://www.imdb.com//title/tt0266543/),"Animation Adventure ComedyAfter his son is captured in the Great Barrier Reef and taken to Sydney, a timid clownfish sets out on a journey to bring him home.Lee Unkrich Albert Brooks Ellen DeGeneres Alexander Gould Willem DafoeAndrew Stanton"
259,Catch Me If You Can (2002),Catch Me If You Can,2002,8.1,903328,Biography Crime Drama,Steven Spielberg,Leonardo DiCaprio Tom Hanks Christopher Walken Martin Sheen,141,"Barely 21 yet, Frank is a skilled forger who has passed as a doctor, lawyer and pilot. FBI agent Carl becomes obsessed with tracking down the con man, who only revels in the pursuit.",https://www.imdb.com//title/tt0264464/,"https://m.media-amazon.com/images/M/MV5BMTY5MzYzNjc5NV5BMl5BanBnXkFtZTYwNTUyNTc2._V1_UX67_CR0,0,67,98_AL_.jpg",2021-12-16T06:03:30.283081+00:00,0,0,1,0,0,0,0,0,1,0,0,0,0,0,0,1,0,0,0,0,0,[Catch Me If You Can (2002)](https://www.imdb.com//title/tt0264464/),"Biography Crime DramaBarely 21 yet, Frank is a skilled forger who has passed as a doctor, lawyer and pilot. FBI agent Carl becomes obsessed with tracking down the con man, who only revels in the pursuit.Leonardo DiCaprio Tom Hanks Christopher Walken Martin SheenSteven Spielberg"
