,movie_year,movie,year,rating,vote_count,genres,director,stars,runtime,description,movie_url,poster_url,created_at,family,fantasy,biography,romance,musical,sport,sci-fi,action,crime,horror,adventure,history,western,animation,comedy,drama,thriller,film-noir,mystery,war,music,title_link,combined_features
493,"I, Daniel Blake (2016)","I, Daniel Blake",2016,7.9,57733,Drama,Ken Loach,Dave Johns Hayley Squires Sharon Percy Briana Shann,100,"After surviving a heart-attack, a 59-year-old carpenter must fight bureaucratic forces to receive Employment and Support Allowance.",https://www.imdb.com//title/tt5168192/,"https://m.media-amazon.com/images/M/MV5BMTQ4NTMzMTk4NV5BMl5BanBnXkFtZTgwNTU5MjE4MDI@._V1_UX67_CR0,0,67,98_AL_.jpg",2021-12-16T06:03:30.283081+00:00,0,0,0,0,0,0,0,0,0,0,0,0,0,0,0,1,0,0,0,0,0,"[I, Daniel Blake (2016)](https://www.imdb.com//title/tt5168192/)","DramaAfter surviving a heart-attack, a 59-year-old carpenter must fight bureaucratic forces to receive Employment and Support Allowance.Dave Johns Hayley Squires Sharon Percy Briana ShannKen Loach"
494,Hidden Figures (2016),Hidden Figures,2016,7.9,215221,Biography Drama History,Theodore Melfi,Taraji P. Henson Octavia Spencer Janelle Monáe Kevin Costner,127,The story of a team of female African-American mathematicians who served a vital role in NASA during the early years of the U.S. space program.,https://www.imdb.com//title/tt4846340/,"https://m.media-amazon.com/images/M/MV5BMzg2Mzg4YmUtNDdkNy00NWY1LWE3NmEtZWMwNGNlMzE5YzU3XkEyXkFqcGdeQXVyMjA5MTIzMjQ@._V1_UX67_CR0,0,67,98_AL_.jpg",2021-12-16T06:03:30.283081+00:00,0,0,1,0,0,0,0,0,0,0,0,1,0,0,0,1,0,0,0,0,0,[Hidden Figures (2016)](https://www.imdb.com//title/tt4846340/),Biography Drama HistoryThe story of a team of female African-American mathematicians who served a vital role in NASA during the early years of the U.S. space program.Taraji P. Henson Octavia Spencer Janelle Monáe Kevin CostnerTheodore Melfi
495,Hunt for the Wilderpeople (2016),Hunt for the Wilderpeople,2016,7.9,122550,Adventure Comedy Drama,Taika Waititi,Sam Neill Julian Dennison Rima Te Wiata Rachel House,101,A national manhunt is ordered for a rebellious kid and his foster uncle who go missing in the wild New Zealand bush.,https://www.imdb.com//title/tt4698684/,"https://m.media-amazon.com/images/M/MV5BMjI1MDQ2MDg5Ml5BMl5BanBnXkFtZTgwMjc2NjM5ODE@._V1_UX67_CR0,0,67,98_AL_.jpg",2021-12-16T06:03:30.283081+00:00,0,0,0,0,0,0,0,0,0,0,1,0,0,0,1,1,0,0,0,0,0,[Hunt for the Wilderpeople (2016)](https://www.imdb.com//title/tt4698684/),Adventure Comedy DramaA national manhunt is ordered for a rebellious kid and his foster uncle who go missing in the wild New Zealand bush.Sam Neill Julian Dennison Rima Te Wiata Rachel HouseTaika Waititi
496,Captain Fantastic (2016),Captain Fantastic,2016,7.9,208297,Comedy Drama,Matt Ross,Viggo Mortensen George MacKay Samantha Isler Annalise Basso,118,"In the forests of the Pacific Northwest, a father devoted to raising his six kids with a rigorous physical and intellectual education is forced to leave his paradise and enter the world, challenging his idea of what it means to be a parent.",https://www.imdb.com//title/tt3553976/,"https://m.media-amazon.com/images/M/MV5BMjE5OTM0OTY5NF5BMl5BanBnXkFtZTgwMDcxOTQ3ODE@._V1_UX67_CR0,0,67,98_AL_.jpg",2021-12-16T06:03:30.283081+00:00,0,0,0,0,0,0,0,0,0,0,0,0,0,0,1,1,0,0,0,0,0,[Captain Fantastic (2016)](https://www.imdb.com//title/tt3553976/),"Comedy DramaIn the forests of the Pacific Northwest, a father devoted to raising his six kids with a rigorous physical and intellectual education is forced to leave his paradise and enter the world, challenging his idea of what it means to be a parent.Viggo Mortensen George MacKay Samantha Isler Annalise BassoMatt Ross"
497,Sing Street (2016),Sing Street,2016,7.9,90290,Comedy Drama Music,John Carney,Ferdia Walsh-Peelo Aidan Gillen Maria Doyle Kennedy Jack Reynor,106,A boy growing up in Dublin during the 1980s escapes his strained family life by starting a band to impress the mysterious girl he likes.,https://www.imdb.com//title/tt3544112/,"https://m.media-amazon.com/images/M/MV5BMjEzODA3MDcxMl5BMl5BanBnXkFtZTgwODgxNDk3NzE@._V1_UX67_CR0,0,67,98_AL_.jpg",2021-12-16T06:03:30.283081+00:00,0,0,0,0,0,0,0,0,0,0,0,0,0,0,1,1,0,0,0,0,1,[Sing Street (2016)](https://www.imdb.com//title/tt3544112/),Comedy Drama MusicA boy growing up in Dublin during the 1980s escapes his strained family life by starting a band to impress the mysterious girl he likes.Ferdia Walsh-Peelo Aidan Gillen Maria Doyle Kennedy Jack ReynorJohn Carney
498,Thor: Ragnarok (2017),Thor: Ragnarok,2017,7.9,662439,Action Adventure Comedy,Taika Waititi,Chris Hemsworth Tom Hiddleston Cate Blanchett Mark Ruffalo,130,"Imprisoned on the planet Sakaar, Thor must race against time to return to Asgard and stop Ragnarök, the destruction of his world, at the hands of the powerful and ruthless villain Hela.",https://www.imdb.com//title/tt3501632/,"https://m.media-amazon.com/images/M/MV5BMjMyNDkzMzI1OF5BMl5BanBnXkFtZTgwODcxODg5MjI@._V1_UX67_CR0,0,67,98_AL_.jpg",2021-12-16T06:03:30.283081+00:00,0,0,0,0,0,0,0,1,0,0,1,0,0,0,1,0,0,0,0,0,0,[Thor: Ragnarok (2017)](https://www.imdb.com//title/tt3501632/),"Action Adventure ComedyImprisoned on the planet Sakaar, Thor must race against time to return to Asgard and stop Ragnarök, the destruction of his world, at the hands of the powerful and ruthless villain Hela.Chris Hemsworth Tom Hiddleston Cate Blanchett Mark RuffaloTaika Waititi"
499,Jojo Rabbit (2019),Jojo Rabbit,2019,7.9,348344,Comedy Drama War,Taika Waititi,Roman Griffin Davis Thomasin McKenzie Scarlett Johansson Taika Waititi,108,A young German boy in the Hitler Youth whose hero and imaginary friend is the country's dictator is shocked to discover that his mother is hiding a Jewish girl in their home.,https://www.imdb.com//title/tt2584384/,"https://m.media-amazon.com/images/M/MV5BZjU0Yzk2MzEtMjAzYy00MzY0LTg2YmItM2RkNzdkY2ZhN2JkXkEyXkFqcGdeQXVyNDg4NjY5OTQ@._V1_UX67_CR0,0,67,98_AL_.jpg",2021-12-16T06:03:30.283081+00:00,0,0,0,0,0,0,0,0,0,0,0,0,0,0,1,1,0,0,0,1,0,[Jojo Rabbit (2019)](https://www.imdb.com//title/tt2584384/),Comedy Drama WarA young German boy in the Hitler Youth whose hero and imaginary friend is the country's dictator is shocked to discover that his mother is hiding a Jewish girl in their home.Roman Griffin Davis Thomasin McKenzie Scarlett Johansson Taika WaititiTaika Waititi
500,Arrival (2016),Arrival,2016,7.9,650793,Drama Sci-Fi,Denis Villeneuve,Amy Adams Jeremy Renner Forest Whitaker Michael Stuhlbarg,116,A linguist works with the military to communicate with alien lifeforms after twelve mysterious spacecraft appear around the world.,https://www.imdb.com//title/tt2543164/,"https://m.media-amazon.com/images/M/MV5BMTExMzU0ODcxNDheQTJeQWpwZ15BbWU4MDE1OTI4MzAy._V1_UX67_CR0,0,67,98_AL_.jpg",2021-12-16T06:03:30.283081+00:00,0,0,0,0,0,0,1,0,0,0,0,0,0,0,0,1,0,0,0,0,0,[Arrival (2016)](https://www.imdb.com//title/tt2543164/),Drama Sci-FiA linguist works with the military to communicate with alien lifeforms after twelve mysterious spacecraft appear around the world.Amy Adams Jeremy Renner Forest Whitaker Michael StuhlbargDenis Villeneuve
501,Gully Boy (2019),Gully Boy,2019,7.9,36438,Drama Music Romance,Zoya Akhtar,Vijay Varma Nakul Roshan Sahdev Ranveer Singh Vijay Raaz,154,A coming-of-age story based on the lives of street rappers in Mumbai.,https://www.imdb.com//title/tt2395469/,"https://m.media-amazon.com/images/M/MV5BZDkzMTQ1YTMtMWY4Ny00MzExLTkzYzEtNzZhOTczNzU2NTU1XkEyXkFqcGdeQXVyODY3NjMyMDU@._V1_UY98_CR4,0,67,98_AL_.jpg",2021-12-16T06:03:30.283081+00:00,0,0,0,1,0,0,0,0,0,0,0,0,0,0,0,1,0,0,0,0,1,[Gully Boy (2019)](https://www.imdb.com//title/tt2395469/),Drama Music RomanceA coming-of-age story based on the lives of street rappers in Mumbai.Vijay Varma Nakul Roshan Sahdev Ranveer Singh Vijay RaazZoya Akhtar
502,Before Midnight (2013),Before Midnight,2013,7.9,150478,Drama Romance,Richard Linklater,Ethan Hawke Julie Delpy Seamus Davey-Fitzpatrick Ariane Labed,109,We meet Jesse and Celine nine years on in Greece. Almost two decades have passed since their first meeting on that train bound for Vienna.,https://www.imdb.com//title/tt2209418/,"https://m.media-amazon.com/images/M/MV5BMjA5NzgxODE2NF5BMl5BanBnXkFtZTcwNTI1NTI0OQ@@._V1_UX67_CR0,0,67,98_AL_.jpg",2021-12-16T06:03:30.283081+00:00,0,0,0,1,0,0,0,0,0,0,0,0,0,0,0,1,0,0,0,0,0,[Before Midnight (2013)](https://www.imdb.com//title/tt2209418/),Drama RomanceWe meet Jesse and Celine nine years on in Greece. Almost two decades have passed since their first meeting on that train bound for Vienna.Ethan Hawke Julie Delpy Seamus Davey-Fitzpatrick Ariane LabedRichard Linklater
503,X-Men: Days of Future Past (2014),X-Men: Days of Future Past,2014,7.9,685105,Action Adventure Sci-Fi,Bryan Singer,Patrick Stewart Ian McKellen Hugh Jackman James McAvoy,132,The X-Men send Wolverine to the past in a desperate effort to change history and prevent an event that results in doom for both humans and mutants.,https://www.imdb.com//title/tt1877832/,"https://m.media-amazon.com/images/M/MV5BZGIzNWYzN2YtMjcwYS00YjQ3LWI2NjMtOTNiYTUyYjE2MGNkXkEyXkFqcGdeQXVyMTQxNzMzNDI@._V1_UX67_CR0,0,67,98_AL_.jpg",2021-12-16T06:03:30.283081+00:00,0,0,0,0,0,0,1,1,0,0,1,0,0,0,0,0,0,0,0,0,0,[X-Men: Days of Future Past (2014)](https://www.imdb.com//title/tt1877832/),Action Adventure Sci-FiThe X-Men send Wolverine to the past in a desperate effort to change history and prevent an event that results in doom for both humans and mutants.Patrick Stewart Ian McKellen Hugh Jackman James McAvoyBryan Singer
504,Once Upon a Time in Anatolia (2011),Once Upon a Time in Anatolia,2011,7.9,44973,Crime Drama,Nuri Bilge Ceylan,Muhammet Uzuner Yilmaz Erdogan Taner Birsel Ahmet Mümtaz Taylan,157,A group of men set out in search of a dead body in the Anatolian steppes.,https://www.imdb.com//title/tt1827487/,"https://m.media-amazon.com/images/M/MV5BMDIwYTU3NDktNmJkOS00NmUyLWI3ZmUtNjViZjU4OTM3OTE3XkEyXkFqcGdeQXVyMTI3ODAyMzE2._V1_UY98_CR0,0,67,98_AL_.jpg",2021-12-16T06:03:30.283081+00:00,0,0,0,0,0,0,0,0,1,0,0,0,0,0,0,1,0,0,0,0,0,[Once Upon a Time in Anatolia (2011)](https://www.imdb.com//title/tt1827487/),Crime DramaA group of men set out in search of a dead body in the Anatolian steppes.Muhammet Uzuner Yilmaz Erdogan Taner Birsel Ahmet Mümtaz TaylanNuri Bilge Ceylan
505,Bohemian Rhapsody (2018),Bohemian Rhapsody,2018,7.9,497699,Biography Drama Music,Bryan Singer,Rami Malek Lucy Boynton Gwilym Lee Ben Hardy,134,"The story of the legendary British rock band Queen and lead singer Freddie Mercury, leading up to their famous performance at Live Aid (1985).",https://www.imdb.com//title/tt1727824/,"https://m.media-amazon.com/images/M/MV5BMTA2NDc3Njg5NDVeQTJeQWpwZ15BbWU4MDc1NDcxNTUz._V1_UX67_CR0,0,67,98_AL_.jpg",2021-12-16T06:03:30.283081+00:00,0,0,1,0,0,0,0,0,0,0,0,0,0,0,0,1,0,0,0,0,1,[Bohemian Rhapsody (2018)](https://www.imdb.com//title/tt1727824/),"Biography Drama MusicThe story of the legendary British rock band Queen and lead singer Freddie Mercury, leading up to their famous performance at Live Aid (1985).Rami Malek Lucy Boynton Gwilym Lee Ben HardyBryan Singer"
506,The Perks of Being a Wallflower (2012),The Perks of Being a Wallflower,2012,7.9,486890,Drama Romance,Stephen Chbosky,Logan Lerman Emma Watson Ezra Miller Paul Rudd,103,An introvert freshman is taken under the wings of two seniors who welcome him to the real world.,https://www.imdb.com//title/tt1659337/,"https://m.media-amazon.com/images/M/MV5BZThjMmQ5YjktMTUyMC00MjljLWJmMTAtOWIzNDIzY2VhNzQ0XkEyXkFqcGdeQXVyMTAyNjg4NjE0._V1_UX67_CR0,0,67,98_AL_.jpg",2021-12-16T06:03:30.283081+00:00,0,0,0,1,0,0,0,0,0,0,0,0,0,0,0,1,0,0,0,0,0,[The Perks of Being a Wallflower (2012)](https://www.imdb.com//title/tt1659337/),Drama RomanceAn introvert freshman is taken under the wings of two seniors who welcome him to the real world.Logan Lerman Emma Watson Ezra Miller Paul RuddStephen Chbosky
507,The Artist (2011),The Artist,2011,7.9,237126,Comedy Drama Romance,Michel Hazanavicius,Jean Dujardin Bérénice Bejo John Goodman James Cromwell,100,An egomaniacal film star develops a relationship with a young dancer against the backdrop of Hollywood's silent era.,https://www.imdb.com//title/tt1655442/,"https://m.media-amazon.com/images/M/MV5BMDUyZWU5N2UtOWFlMy00MTI0LTk0ZDYtMzFhNjljODBhZDA5XkEyXkFqcGdeQXVyNzA4ODc3ODU@._V1_UY98_CR1,0,67,98_AL_.jpg",2021-12-16T06:03:30.283081+00:00,0,0,0,1,0,0,0,0,0,0,0,0,0,0,1,1,0,0,0,0,0,[The Artist (2011)](https://www.imdb.com//title/tt1655442/),Comedy Drama RomanceAn egomaniacal film star develops a relationship with a young dancer against the backdrop of Hollywood's silent era.Jean Dujardin Bérénice Bejo John Goodman James CromwellMichel Hazanavicius
508,Edge of Tomorrow (2014),Edge of Tomorrow,2014,7.9,639706,Action Adventure Sci-Fi,Doug Liman,Tom Cruise Emily Blunt Bill Paxton Brendan Gleeson,113,"A soldier fighting aliens gets to relive the same day over and over again, the day restarting every time he dies.",https://www.imdb.com//title/tt1631867/,"https://m.media-amazon.com/images/M/MV5BMTc5OTk4MTM3M15BMl5BanBnXkFtZTgwODcxNjg3MDE@._V1_UX67_CR0,0,67,98_AL_.jpg",2021-12-16T06:03:30.283081+00:00,0,0,0,0,0,0,1,1,0,0,1,0,0,0,0,0,0,0,0,0,0,[Edge of Tomorrow (2014)](https://www.imdb.com//title/tt1631867/),"Action Adventure Sci-FiA soldier fighting aliens gets to relive the same day over and over again, the day restarting every time he dies.Tom Cruise Emily Blunt Bill Paxton Brendan GleesonDoug Liman"
509,Amour (2012),Amour,2012,7.9,97401,Drama,Michael Haneke,Jean-Louis Trintignant Emmanuelle Riva Isabelle Huppert Alexandre Tharaud,127,"Georges and Anne are an octogenarian couple. They are cultivated, retired music teachers. Their daughter, also a musician, lives in Britain with her family. One day, Anne has a stroke, and the couple's bond of love is severely tested.",https://www.imdb.com//title/tt1602620/,"https://m.media-amazon.com/images/M/MV5BMTk1NTc3NDc4MF5BMl5BanBnXkFtZTcwNjYwNDk0OA@@._V1_UX67_CR0,0,67,98_AL_.jpg",2021-12-16T06:03:30.283081+00:00,0,0,0,0,0,0,0,0,0,0,0,0,0,0,0,1,0,0,0,0,0,[Amour (2012)](https://www.imdb.com//title/tt1602620/),"DramaGeorges and Anne are an octogenarian couple. They are cultivated, retired music teachers. Their daughter, also a musician, lives in Britain with her family. One day, Anne has a stroke, and the couple's bond of love is severely tested.Jean-Louis Trintignant Emmanuelle Riva Isabelle Huppert Alexandre TharaudMichael Haneke"
510,A Prophet (2009),A Prophet,2009,7.9,96862,Crime Drama,Jacques Audiard,Tahar Rahim Niels Arestrup Adel Bencherif Reda Kateb,155,A young Algerian man is sent to a French prison.,https://www.imdb.com//title/tt1235166/,"https://m.media-amazon.com/images/M/MV5BMTUyMjQ1MTY5OV5BMl5BanBnXkFtZTcwNzY5NjExMw@@._V1_UY98_CR1,0,67,98_AL_.jpg",2021-12-16T06:03:30.283081+00:00,0,0,0,0,0,0,0,0,1,0,0,0,0,0,0,1,0,0,0,0,0,[A Prophet (2009)](https://www.imdb.com//title/tt1235166/),Crime DramaA young Algerian man is sent to a French prison.Tahar Rahim Niels Arestrup Adel Bencherif Reda KatebJacques Audiard
511,Let the Right One In (2008),Let the Right One In,2008,7.9,211914,Crime Drama Fantasy,Tomas Alfredson,Kåre Hedebrant Lina Leandersson Per Ragnar Henrik Dahl,114,"Oskar, an overlooked and bullied boy, finds love and revenge through Eli, a beautiful but peculiar girl.",https://www.imdb.com//title/tt1139797/,"https://m.media-amazon.com/images/M/MV5BOWM4NTY2NTMtZDZlZS00NTgyLWEzZDMtODE3ZGI1MzI3ZmU5XkEyXkFqcGdeQXVyNzI1NzMxNzM@._V1_UY98_CR1,0,67,98_AL_.jpg",2021-12-16T06:03:30.283081+00:00,0,1,0,0,0,0,0,0,1,0,0,0,0,0,0,1,0,0,0,0,0,[Let the Right One In (2008)](https://www.imdb.com//title/tt1139797/),"Crime Drama FantasyOskar, an overlooked and bullied boy, finds love and revenge through Eli, a beautiful but peculiar girl.Kåre Hedebrant Lina Leandersson Per Ragnar Henrik DahlTomas Alfredson"
512,District 9 (2009),District 9,2009,7.9,660188,Action Sci-Fi Thriller,Neill Blomkamp,Sharlto Copley David James Jason Cope Nathalie Boltt,112,Violence ensues after an extraterrestrial race forced to live in slum-like conditions on Earth finds a kindred spirit in a government agent exposed to their biotechnology.,https://www.imdb.com//title/tt1136608/,"https://m.media-amazon.com/images/M/MV5BYmQ5MzFjYWMtMTMwNC00ZGU5LWI3YTQtYzhkMGExNGFlY2Q0XkEyXkFqcGdeQXVyNTIzOTk5ODM@._V1_UX67_CR0,0,67,98_AL_.jpg",2021-12-16T06:03:30.283081+00:00,0,0,0,0,0,0,1,1,0,0,0,0,0,0,0,0,1,0,0,0,0,[District 9 (2009)](https://www.imdb.com//title/tt1136608/),Action Sci-Fi ThrillerViolence ensues after an extraterrestrial race forced to live in slum-like conditions on Earth finds a kindred spirit in a government agent exposed to their biotechnology.Sharlto Copley David James Jason Cope Nathalie BolttNeill Blomkamp
513,The Wrestler (2008),The Wrestler,2008,7.9,298667,Drama Sport,Darren Aronofsky,Mickey Rourke Marisa Tomei Evan Rachel Wood Mark Margolis,109,"A faded professional wrestler must retire, but finds his quest for a new life outside the ring a dispiriting struggle.",https://www.imdb.com//title/tt1125849/,"https://m.media-amazon.com/images/M/MV5BMTc5MjYyOTg4MF5BMl5BanBnXkFtZTcwNDc2MzQwMg@@._V1_UX67_CR0,0,67,98_AL_.jpg",2021-12-16T06:03:30.283081+00:00,0,0,0,0,0,1,0,0,0,0,0,0,0,0,0,1,0,0,0,0,0,[The Wrestler (2008)](https://www.imdb.com//title/tt1125849/),"Drama SportA faded professional wrestler must retire, but finds his quest for a new life outside the ring a dispiriting struggle.Mickey Rourke Marisa Tomei Evan Rachel Wood Mark MargolisDarren Aronofsky"
514,Jab We Met (2007),Jab We Met,2007,7.9,50770,Comedy Drama Romance,Imtiaz Ali,Shahid Kapoor Kareena Kapoor Tarun Arora Dara Singh,138,A depressed wealthy businessman finds his life changing after he meets a spunky and care-free young woman.,https://www.imdb.com//title/tt1093370/,"https://m.media-amazon.com/images/M/MV5BYmIzYmY4MGItM2I4YS00OWZhLWFmMzQtYzI2MWY1MmM3NGU1XkEyXkFqcGdeQXVyNjQ2MjQ5NzM@._V1_UY98_CR0,0,67,98_AL_.jpg",2021-12-16T06:03:30.283081+00:00,0,0,0,1,0,0,0,0,0,0,0,0,0,0,1,1,0,0,0,0,0,[Jab We Met (2007)](https://www.imdb.com//title/tt1093370/),Comedy Drama RomanceA depressed wealthy businessman finds his life changing after he meets a spunky and care-free young woman.Shahid Kapoor Kareena Kapoor Tarun Arora Dara SinghImtiaz Ali
515,Boyhood (2014),Boyhood,2014,7.9,346485,Drama,Richard Linklater,Ellar Coltrane Patricia Arquette Ethan Hawke Elijah Smith,165,"The life of Mason, from early childhood to his arrival at college.",https://www.imdb.com//title/tt1065073/,"https://m.media-amazon.com/images/M/MV5BMTYzNDc2MDc0N15BMl5BanBnXkFtZTgwOTcwMDQ5MTE@._V1_UX67_CR0,0,67,98_AL_.jpg",2021-12-16T06:03:30.283081+00:00,0,0,0,0,0,0,0,0,0,0,0,0,0,0,0,1,0,0,0,0,0,[Boyhood (2014)](https://www.imdb.com//title/tt1065073/),"DramaThe life of Mason, from early childhood to his arrival at college.Ellar Coltrane Patricia Arquette Ethan Hawke Elijah SmithRichard Linklater"
516,"4 Months, 3 Weeks and 2 Days (2007)","4 Months, 3 Weeks and 2 Days",2007,7.9,58895,Drama,Cristian Mungiu,Anamaria Marinca Laura Vasiliu Vlad Ivanov Alexandru Potocean,113,A woman assists her friend in arranging an illegal abortion in 1980s Romania.,https://www.imdb.com//title/tt1032846/,"https://m.media-amazon.com/images/M/MV5BYzU1YWUzNjYtNmVhZi00ODUyLTg4M2ItMTFlMmU1Mzc5OTE5XkEyXkFqcGdeQXVyMTMxODk2OTU@._V1_UY98_CR1,0,67,98_AL_.jpg",2021-12-16T06:03:30.283081+00:00,0,0,0,0,0,0,0,0,0,0,0,0,0,0,0,1,0,0,0,0,0,"[4 Months, 3 Weeks and 2 Days (2007)](https://www.imdb.com//title/tt1032846/)",DramaA woman assists her friend in arranging an illegal abortion in 1980s Romania.Anamaria Marinca Laura Vasiliu Vlad Ivanov Alexandru PotoceanCristian Mungiu
517,Star Trek (2009),Star Trek,2009,7.9,592904,Action Adventure Sci-Fi,J.J. Abrams,Chris Pine Zachary Quinto Simon Pegg Leonard Nimoy,127,The brash James T. Kirk tries to live up to his father's legacy with Mr. Spock keeping him in check as a vengeful Romulan from the future creates black holes to destroy the Federation one planet at a time.,https://www.imdb.com//title/tt0796366/,"https://m.media-amazon.com/images/M/MV5BMjE5NDQ5OTE4Ml5BMl5BanBnXkFtZTcwOTE3NDIzMw@@._V1_UX67_CR0,0,67,98_AL_.jpg",2021-12-16T06:03:30.283081+00:00,0,0,0,0,0,0,1,1,0,0,1,0,0,0,0,0,0,0,0,0,0,[Star Trek (2009)](https://www.imdb.com//title/tt0796366/),Action Adventure Sci-FiThe brash James T. Kirk tries to live up to his father's legacy with Mr. Spock keeping him in check as a vengeful Romulan from the future creates black holes to destroy the Federation one planet at a time.Chris Pine Zachary Quinto Simon Pegg Leonard NimoyJ.J. Abrams
518,In Bruges (2008),In Bruges,2008,7.9,406729,Comedy Crime Drama,Martin McDonagh,Colin Farrell Brendan Gleeson Ciarán Hinds Elizabeth Berrington,107,"Guilt-stricken after a job gone wrong, hitman Ray and his partner await orders from their ruthless boss in Bruges, Belgium, the last place in the world Ray wants to be.",https://www.imdb.com//title/tt0780536/,"https://m.media-amazon.com/images/M/MV5BMTUwOGFiM2QtOWMxYS00MjU2LThmZDMtZDM2MWMzNzllNjdhXkEyXkFqcGdeQXVyMTMxODk2OTU@._V1_UX67_CR0,0,67,98_AL_.jpg",2021-12-16T06:03:30.283081+00:00,0,0,0,0,0,0,0,0,1,0,0,0,0,0,1,1,0,0,0,0,0,[In Bruges (2008)](https://www.imdb.com//title/tt0780536/),"Comedy Crime DramaGuilt-stricken after a job gone wrong, hitman Ray and his partner await orders from their ruthless boss in Bruges, Belgium, the last place in the world Ray wants to be.Colin Farrell Brendan Gleeson Ciarán Hinds Elizabeth BerringtonMartin McDonagh"
519,The Man from Earth (2007),The Man from Earth,2007,7.9,182254,Drama Fantasy Mystery,Richard Schenkman,David Lee Smith Tony Todd John Billingsley Ellen Crawford,87,An impromptu goodbye party for Professor John Oldman becomes a mysterious interrogation after the retiring scholar reveals to his colleagues he has a longer and stranger past than they can imagine.,https://www.imdb.com//title/tt0756683/,"https://m.media-amazon.com/images/M/MV5BMzQ5NGQwOTUtNWJlZi00ZTFiLWI0ZTEtOGU3MTA2ZGU5OWZiXkEyXkFqcGdeQXVyMTczNjQwOTY@._V1_UX67_CR0,0,67,98_AL_.jpg",2021-12-16T06:03:30.283081+00:00,0,1,0,0,0,0,0,0,0,0,0,0,0,0,0,1,0,0,1,0,0,[The Man from Earth (2007)](https://www.imdb.com//title/tt0756683/),Drama Fantasy MysteryAn impromptu goodbye party for Professor John Oldman becomes a mysterious interrogation after the retiring scholar reveals to his colleagues he has a longer and stranger past than they can imagine.David Lee Smith Tony Todd John Billingsley Ellen CrawfordRichard Schenkman
520,Letters from Iwo Jima (2006),Letters from Iwo Jima,2006,7.9,159215,Action Adventure Drama,Clint Eastwood,Ken Watanabe Kazunari Ninomiya Tsuyoshi Ihara Ryô Kase,141,"The story of the battle of Iwo Jima between the United States and Imperial Japan during World War II, as told from the perspective of the Japanese who fought it.",https://www.imdb.com//title/tt0498380/,"https://m.media-amazon.com/images/M/MV5BMjE0NzgwODI4M15BMl5BanBnXkFtZTcwNjg3OTA0MQ@@._V1_UX67_CR0,0,67,98_AL_.jpg",2021-12-16T06:03:30.283081+00:00,0,0,0,0,0,0,0,1,0,0,1,0,0,0,0,1,0,0,0,0,0,[Letters from Iwo Jima (2006)](https://www.imdb.com//title/tt0498380/),"Action Adventure DramaThe story of the battle of Iwo Jima between the United States and Imperial Japan during World War II, as told from the perspective of the Japanese who fought it.Ken Watanabe Kazunari Ninomiya Tsuyoshi Ihara Ryô KaseClint Eastwood"
521,The Fall (2006),The Fall,2006,7.9,110340,Adventure Drama Fantasy,Tarsem Singh,Lee Pace Catinca Untaru Justine Waddell Kim Uylenbroek,117,"In a hospital on the outskirts of 1920s Los Angeles, an injured stuntman begins to tell a fellow patient, a little girl with a broken arm, a fantastic story of five mythical heroes. Thanks to his fractured state of mind and her vivid imagination, the line between fiction and reality blurs as the tale advances.",https://www.imdb.com//title/tt0460791/,"https://m.media-amazon.com/images/M/MV5BMjAzODUwMjM1M15BMl5BanBnXkFtZTcwNjU2MjU2MQ@@._V1_UX67_CR0,0,67,98_AL_.jpg",2021-12-16T06:03:30.283081+00:00,0,1,0,0,0,0,0,0,0,0,1,0,0,0,0,1,0,0,0,0,0,[The Fall (2006)](https://www.imdb.com//title/tt0460791/),"Adventure Drama FantasyIn a hospital on the outskirts of 1920s Los Angeles, an injured stuntman begins to tell a fellow patient, a little girl with a broken arm, a fantastic story of five mythical heroes. Thanks to his fractured state of mind and her vivid imagination, the line between fiction and reality blurs as the tale advances.Lee Pace Catinca Untaru Justine Waddell Kim UylenbroekTarsem Singh"
522,Life of Pi (2012),Life of Pi,2012,7.9,605460,Adventure Drama Fantasy,Ang Lee,Suraj Sharma Irfan Khan Adil Hussain Tabu,127,"A young man who survives a disaster at sea is hurtled into an epic journey of adventure and discovery. While cast away, he forms an unexpected connection with another survivor: a fearsome Bengal tiger.",https://www.imdb.com//title/tt0454876/,"https://m.media-amazon.com/images/M/MV5BNTg2OTY2ODg5OF5BMl5BanBnXkFtZTcwODM5MTYxOA@@._V1_UX67_CR0,0,67,98_AL_.jpg",2021-12-16T06:03:30.283081+00:00,0,1,0,0,0,0,0,0,0,0,1,0,0,0,0,1,0,0,0,0,0,[Life of Pi (2012)](https://www.imdb.com//title/tt0454876/),"Adventure Drama FantasyA young man who survives a disaster at sea is hurtled into an epic journey of adventure and discovery. While cast away, he forms an unexpected connection with another survivor: a fearsome Bengal tiger.Suraj Sharma Irfan Khan Adil Hussain TabuAng Lee"
