,movie_year,movie,year,rating,vote_count,genres,director,stars,runtime,description,movie_url,poster_url,created_at,family,fantasy,biography,romance,musical,sport,sci-fi,action,crime,horror,adventure,history,western,animation,comedy,drama,thriller,film-noir,mystery,war,music,title_link,combined_features
753,Deadpool 2 (2018),Deadpool 2,2018,7.7,529836,Action Adventure Comedy,David Leitch,Ryan Reynolds Josh Brolin Morena Baccarin Julian Dennison,119,"Foul-mouthed mutant mercenary Wade Wilson (a.k.a. Deadpool) assembles a team of fellow mutant rogues to protect a young boy with supernatural abilities from the brutal, time-traveling cyborg Cable.",https://www.imdb.com//title/tt5463162/,"https://m.media-amazon.com/images/M/MV5BMDkzNmRhNTMtZDI4NC00Zjg1LTgxM2QtMjYxZDQ3OWJlMDRlXkEyXkFqcGdeQXVyNTU5MjkzMTU@._V1_UX67_CR0,0,67,98_AL_.jpg",2021-12-16T06:03:30.283081+00:00,0,0,0,0,0,0,0,1,0,0,1,0,0,0,1,0,0,0,0,0,0,[Deadpool 2 (2018)](https://www.imdb.com//title/tt5463162/),"Action Adventure ComedyFoul-mouthed mutant mercenary Wade Wilson (a.k.a. Deadpool) assembles a team of fellow mutant rogues to protect a young boy with supernatural abilities from the brutal, time-traveling cyborg Cable.Ryan Reynolds Josh Brolin Morena Baccarin Julian DennisonDavid Leitch"
754,Wind River (2017),Wind River,2017,7.7,230264,Crime Drama Mystery,Taylor Sheridan,Elizabeth Olsen Jeremy Renner Graham Greene Kelsey Asbille,107,A veteran hunter helps an FBI agent investigate the murder of a young woman on a Wyoming Native American reservation.,https://www.imdb.com//title/tt5362988/,"https://m.media-amazon.com/images/M/MV5BMTUyMjU1OTUwM15BMl5BanBnXkFtZTgwMDg1NDQ2MjI@._V1_UX67_CR0,0,67,98_AL_.jpg",2021-12-16T06:03:30.283081+00:00,0,0,0,0,0,0,0,0,1,0,0,0,0,0,0,1,0,0,1,0,0,[Wind River (2017)](https://www.imdb.com//title/tt5362988/),Crime Drama MysteryA veteran hunter helps an FBI agent investigate the murder of a young woman on a Wyoming Native American reservation.Elizabeth Olsen Jeremy Renner Graham Greene Kelsey AsbilleTaylor Sheridan
755,The Salesman (2016),The Salesman,2016,7.7,57129,Drama,Asghar Farhadi,Shahab Hosseini Taraneh Alidoosti Mina Sadati Babak Karimi,124,"While both participating in a production of ""Death of a Salesman,"" a teacher's wife is assaulted in her new home, which leaves him determined to find the perpetrator over his wife's traumatized objections.",https://www.imdb.com//title/tt5186714/,"https://m.media-amazon.com/images/M/MV5BMTBkMjMyN2UtNzVjNi00Y2ZiLTk2MDYtN2Y0MjgzYjAxNzE4XkEyXkFqcGdeQXVyNjkxOTM4ODY@._V1_UY98_CR1,0,67,98_AL_.jpg",2021-12-16T06:03:30.283081+00:00,0,0,0,0,0,0,0,0,0,0,0,0,0,0,0,1,0,0,0,0,0,[The Salesman (2016)](https://www.imdb.com//title/tt5186714/),"DramaWhile both participating in a production of ""Death of a Salesman,"" a teacher's wife is assaulted in her new home, which leaves him determined to find the perpetrator over his wife's traumatized objections.Shahab Hosseini Taraneh Alidoosti Mina Sadati Babak KarimiAsghar Farhadi"
756,Get Out (2017),Get Out,2017,7.7,540887,Horror Mystery Thriller,Jordan Peele,Daniel Kaluuya Allison Williams Bradley Whitford Catherine Keener,104,"A young African-American visits his white girlfriend's parents for the weekend, where his simmering uneasiness about their reception of him eventually reaches a boiling point.",https://www.imdb.com//title/tt5052448/,"https://m.media-amazon.com/images/M/MV5BMjUxMDQwNjcyNl5BMl5BanBnXkFtZTgwNzcwMzc0MTI@._V1_UX67_CR0,0,67,98_AL_.jpg",2021-12-16T06:03:30.283081+00:00,0,0,0,0,0,0,0,0,0,1,0,0,0,0,0,0,1,0,1,0,0,[Get Out (2017)](https://www.imdb.com//title/tt5052448/),"Horror Mystery ThrillerA young African-American visits his white girlfriend's parents for the weekend, where his simmering uneasiness about their reception of him eventually reaches a boiling point.Daniel Kaluuya Allison Williams Bradley Whitford Catherine KeenerJordan Peele"
757,Mission: Impossible - Fallout (2018),Mission: Impossible - Fallout,2018,7.7,311957,Action Adventure Thriller,Christopher McQuarrie,Tom Cruise Henry Cavill Ving Rhames Simon Pegg,147,"Ethan Hunt and his IMF team, along with some familiar allies, race against time after a mission gone wrong.",https://www.imdb.com//title/tt4912910/,"https://m.media-amazon.com/images/M/MV5BNjRlZmM0ODktY2RjNS00ZDdjLWJhZGYtNDljNWZkMGM5MTg0XkEyXkFqcGdeQXVyNjAwMjI5MDk@._V1_UX67_CR0,0,67,98_AL_.jpg",2021-12-16T06:03:30.283081+00:00,0,0,0,0,0,0,0,1,0,0,1,0,0,0,0,0,1,0,0,0,0,[Mission: Impossible - Fallout (2018)](https://www.imdb.com//title/tt4912910/),"Action Adventure ThrillerEthan Hunt and his IMF team, along with some familiar allies, race against time after a mission gone wrong.Tom Cruise Henry Cavill Ving Rhames Simon PeggChristopher McQuarrie"
758,A Man Called Ove (2015),A Man Called Ove,2015,7.7,51671,Comedy Drama Romance,Hannes Holm,Rolf Lassgård Bahar Pars Filip Berg Ida Engvoll,116,"Ove, an ill-tempered, isolated retiree who spends his days enforcing block association rules and visiting his wife's grave, has finally given up on life just as an unlikely friendship develops with his boisterous new neighbors.",https://www.imdb.com//title/tt4080728/,"https://m.media-amazon.com/images/M/MV5BMjE0NDUyOTc2MV5BMl5BanBnXkFtZTgwODk2NzU3OTE@._V1_UX67_CR0,0,67,98_AL_.jpg",2021-12-16T06:03:30.283081+00:00,0,0,0,1,0,0,0,0,0,0,0,0,0,0,1,1,0,0,0,0,0,[A Man Called Ove (2015)](https://www.imdb.com//title/tt4080728/),"Comedy Drama RomanceOve, an ill-tempered, isolated retiree who spends his days enforcing block association rules and visiting his wife's grave, has finally given up on life just as an unlikely friendship develops with his boisterous new neighbors.Rolf Lassgård Bahar Pars Filip Berg Ida EngvollHannes Holm"
759,What We Do in the Shadows (2014),What We Do in the Shadows,2014,7.7,172317,Comedy Horror,Jemaine Clement,Taika Waititi Jemaine Clement Taika Waititi Cori Gonzalez-Macuer Jonny Brugh,86,"Viago, Deacon, and Vladislav are vampires who are struggling with the mundane aspects of modern life, like paying rent, keeping up with the chore wheel, trying to get into nightclubs, and overcoming flatmate conflicts.",https://www.imdb.com//title/tt3416742/,"https://m.media-amazon.com/images/M/MV5BMjAwNDA5NzEwM15BMl5BanBnXkFtZTgwMTA1MDUyNDE@._V1_UX67_CR0,0,67,98_AL_.jpg",2021-12-16T06:03:30.283081+00:00,0,0,0,0,0,0,0,0,0,1,0,0,0,0,1,0,0,0,0,0,0,[What We Do in the Shadows (2014)](https://www.imdb.com//title/tt3416742/),"Comedy HorrorViago, Deacon, and Vladislav are vampires who are struggling with the mundane aspects of modern life, like paying rent, keeping up with the chore wheel, trying to get into nightclubs, and overcoming flatmate conflicts.Taika Waititi Jemaine Clement Taika Waititi Cori Gonzalez-Macuer Jonny BrughJemaine Clement"
760,When Marnie Was There (2014),When Marnie Was There,2014,7.7,37319,Animation Drama Family,Hiromasa Yonebayashi,Sara Takatsuki Kasumi Arimura Nanako Matsushima Susumu Terajima,103,"Due to 12 y.o. Anna's asthma, she's sent to stay with relatives of her guardian in the Japanese countryside. She likes to be alone, sketching. She befriends Marnie. Who is the mysterious, blonde Marnie.",https://www.imdb.com//title/tt3398268/,"https://m.media-amazon.com/images/M/MV5BZTlmYTJmMWEtNDRhNy00ODc1LTg2OTMtMjk2ODJhNTA4YTE1XkEyXkFqcGdeQXVyMTMxODk2OTU@._V1_UY98_CR0,0,67,98_AL_.jpg",2021-12-16T06:03:30.283081+00:00,1,0,0,0,0,0,0,0,0,0,0,0,0,1,0,1,0,0,0,0,0,[When Marnie Was There (2014)](https://www.imdb.com//title/tt3398268/),"Animation Drama FamilyDue to 12 y.o. Anna's asthma, she's sent to stay with relatives of her guardian in the Japanese countryside. She likes to be alone, sketching. She befriends Marnie. Who is the mysterious, blonde Marnie.Sara Takatsuki Kasumi Arimura Nanako Matsushima Susumu TerajimaHiromasa Yonebayashi"
761,The Theory of Everything (2014),The Theory of Everything,2014,7.7,428944,Biography Drama Romance,James Marsh,Eddie Redmayne Felicity Jones Tom Prior Sophie Perry,123,A look at the relationship between the famous physicist Stephen Hawking and his wife.,https://www.imdb.com//title/tt2980516/,"https://m.media-amazon.com/images/M/MV5BMTAwMTU4MDA3NDNeQTJeQWpwZ15BbWU4MDk4NTMxNTIx._V1_UX67_CR0,0,67,98_AL_.jpg",2021-12-16T06:03:30.283081+00:00,0,0,1,1,0,0,0,0,0,0,0,0,0,0,0,1,0,0,0,0,0,[The Theory of Everything (2014)](https://www.imdb.com//title/tt2980516/),Biography Drama RomanceA look at the relationship between the famous physicist Stephen Hawking and his wife.Eddie Redmayne Felicity Jones Tom Prior Sophie PerryJames Marsh
762,Kingsman: The Secret Service (2014),Kingsman: The Secret Service,2014,7.7,624433,Action Adventure Comedy,Matthew Vaughn,Colin Firth Taron Egerton Samuel L. Jackson Michael Caine,129,"A spy organisation recruits a promising street kid into the agency's training program, while a global threat emerges from a twisted tech genius.",https://www.imdb.com//title/tt2802144/,"https://m.media-amazon.com/images/M/MV5BYTM3ZTllNzItNTNmOS00NzJiLTg1MWMtMjMxNDc0NmJhODU5XkEyXkFqcGdeQXVyODE5NzE3OTE@._V1_UX67_CR0,0,67,98_AL_.jpg",2021-12-16T06:03:30.283081+00:00,0,0,0,0,0,0,0,1,0,0,1,0,0,0,1,0,0,0,0,0,0,[Kingsman: The Secret Service (2014)](https://www.imdb.com//title/tt2802144/),"Action Adventure ComedyA spy organisation recruits a promising street kid into the agency's training program, while a global threat emerges from a twisted tech genius.Colin Firth Taron Egerton Samuel L. Jackson Michael CaineMatthew Vaughn"
763,The Fault in Our Stars (2014),The Fault in Our Stars,2014,7.7,360930,Drama Romance,Josh Boone,Shailene Woodley Ansel Elgort Nat Wolff Laura Dern,126,Two teenage cancer patients begin a life-affirming journey to visit a reclusive author in Amsterdam.,https://www.imdb.com//title/tt2582846/,"https://m.media-amazon.com/images/M/MV5BNTVkMTFiZWItOTFkOC00YTc3LWFhYzQtZTg3NzAxZjJlNTAyXkEyXkFqcGdeQXVyODE5NzE3OTE@._V1_UX67_CR0,0,67,98_AL_.jpg",2021-12-16T06:03:30.283081+00:00,0,0,0,1,0,0,0,0,0,0,0,0,0,0,0,1,0,0,0,0,0,[The Fault in Our Stars (2014)](https://www.imdb.com//title/tt2582846/),Drama RomanceTwo teenage cancer patients begin a life-affirming journey to visit a reclusive author in Amsterdam.Shailene Woodley Ansel Elgort Nat Wolff Laura DernJosh Boone
764,Me and Earl and the Dying Girl (2015),Me and Earl and the Dying Girl,2015,7.7,128199,Comedy Drama,Alfonso Gomez-Rejon,Thomas Mann RJ Cyler Olivia Cooke Nick Offerman,105,"High schooler Greg, who spends most of his time making parodies of classic movies with his co-worker Earl, finds his outlook forever altered after befriending a classmate who has just been diagnosed with cancer.",https://www.imdb.com//title/tt2582496/,"https://m.media-amazon.com/images/M/MV5BZTUwZTkxOGMtMmFjYS00MWU2LTk2YjAtNWUzMzAwODM0NzdiXkEyXkFqcGdeQXVyNTA3MTU2MjE@._V1_UY98_CR3,0,67,98_AL_.jpg",2021-12-16T06:03:30.283081+00:00,0,0,0,0,0,0,0,0,0,0,0,0,0,0,1,1,0,0,0,0,0,[Me and Earl and the Dying Girl (2015)](https://www.imdb.com//title/tt2582496/),"Comedy DramaHigh schooler Greg, who spends most of his time making parodies of classic movies with his co-worker Earl, finds his outlook forever altered after befriending a classmate who has just been diagnosed with cancer.Thomas Mann RJ Cyler Olivia Cooke Nick OffermanAlfonso Gomez-Rejon"
765,Birdman or (The Unexpected Virtue of Ignorance) (2014),Birdman or (The Unexpected Virtue of Ignorance),2014,7.7,606516,Comedy Drama,Alejandro G. Iñárritu,Michael Keaton Zach Galifianakis Edward Norton Andrea Riseborough,119,"A washed-up superhero actor attempts to revive his fading career by writing, directing, and starring in a Broadway production.",https://www.imdb.com//title/tt2562232/,"https://m.media-amazon.com/images/M/MV5BODAzNDMxMzAxOV5BMl5BanBnXkFtZTgwMDMxMjA4MjE@._V1_UX67_CR0,0,67,98_AL_.jpg",2021-12-16T06:03:30.283081+00:00,0,0,0,0,0,0,0,0,0,0,0,0,0,0,1,1,0,0,0,0,0,[Birdman or (The Unexpected Virtue of Ignorance) (2014)](https://www.imdb.com//title/tt2562232/),"Comedy DramaA washed-up superhero actor attempts to revive his fading career by writing, directing, and starring in a Broadway production.Michael Keaton Zach Galifianakis Edward Norton Andrea RiseboroughAlejandro G. Iñárritu"
766,The Past (2013),The Past,2013,7.7,47731,Drama Mystery,Asghar Farhadi,Bérénice Bejo Tahar Rahim Ali Mosaffa Pauline Burlet,130,"An Iranian man deserts his French wife and her two children to return to his homeland. Meanwhile, his wife starts up a new relationship, a reality her husband confronts upon his wife's request for a divorce.",https://www.imdb.com//title/tt2404461/,"https://m.media-amazon.com/images/M/MV5BOTEwNDM1ODEwN15BMl5BanBnXkFtZTcwMzM0NDg0OQ@@._V1_UY98_CR3,0,67,98_AL_.jpg",2021-12-16T06:03:30.283081+00:00,0,0,0,0,0,0,0,0,0,0,0,0,0,0,0,1,0,0,1,0,0,[The Past (2013)](https://www.imdb.com//title/tt2404461/),"Drama MysteryAn Iranian man deserts his French wife and her two children to return to his homeland. Meanwhile, his wife starts up a new relationship, a reality her husband confronts upon his wife's request for a divorce.Bérénice Bejo Tahar Rahim Ali Mosaffa Pauline BurletAsghar Farhadi"
767,Blue Is the Warmest Colour (2013),Blue Is the Warmest Colour,2013,7.7,146191,Drama Romance,Abdellatif Kechiche,Léa Seydoux Adèle Exarchopoulos Salim Kechiouche Aurélien Recoing,180,"Adèle's life is changed when she meets Emma, a young woman with blue hair, who will allow her to discover desire and to assert herself as a woman and as an adult. In front of others, Adèle grows, seeks herself, loses herself, and ultimately finds herself through love and loss.",https://www.imdb.com//title/tt2278871/,"https://m.media-amazon.com/images/M/MV5BMTQ5NTg5ODk4OV5BMl5BanBnXkFtZTgwODc4MTMzMDE@._V1_UX67_CR0,0,67,98_AL_.jpg",2021-12-16T06:03:30.283081+00:00,0,0,0,1,0,0,0,0,0,0,0,0,0,0,0,1,0,0,0,0,0,[Blue Is the Warmest Colour (2013)](https://www.imdb.com//title/tt2278871/),"Drama RomanceAdèle's life is changed when she meets Emma, a young woman with blue hair, who will allow her to discover desire and to assert herself as a woman and as an adult. In front of others, Adèle grows, seeks herself, loses herself, and ultimately finds herself through love and loss.Léa Seydoux Adèle Exarchopoulos Salim Kechiouche Aurélien RecoingAbdellatif Kechiche"
768,The Broken Circle Breakdown (2012),The Broken Circle Breakdown,2012,7.7,40588,Drama Music Romance,Felix van Groeningen,Veerle Baetens Johan Heldenbergh Nell Cattrysse Geert Van Rampelberg,111,"Elise and Didier fall in love at first sight, in spite of their differences. He talks, she listens. He's a romantic atheist, she's a religious realist. When their daughter becomes seriously ill, their love is put on trial.",https://www.imdb.com//title/tt2024519/,"https://m.media-amazon.com/images/M/MV5BZDFhOGZmYjktY2NhYS00NGYxLTljMGMtMmFhMzM5NjM1OWFmXkEyXkFqcGdeQXVyMTA4NjE0NjEy._V1_UX67_CR0,0,67,98_AL_.jpg",2021-12-16T06:03:30.283081+00:00,0,0,0,1,0,0,0,0,0,0,0,0,0,0,0,1,0,0,0,0,1,[The Broken Circle Breakdown (2012)](https://www.imdb.com//title/tt2024519/),"Drama Music RomanceElise and Didier fall in love at first sight, in spite of their differences. He talks, she listens. He's a romantic atheist, she's a religious realist. When their daughter becomes seriously ill, their love is put on trial.Veerle Baetens Johan Heldenbergh Nell Cattrysse Geert Van RampelbergFelix van Groeningen"
769,Toy Story 4 (2019),Toy Story 4,2019,7.7,227762,Animation Adventure Comedy,Josh Cooley,Tom Hanks Tim Allen Annie Potts Tony Hale,100,"When a new toy called ""Forky"" joins Woody and the gang, a road trip alongside old and new friends reveals how big the world can be for a toy.",https://www.imdb.com//title/tt1979376/,"https://m.media-amazon.com/images/M/MV5BMTYzMDM4NzkxOV5BMl5BanBnXkFtZTgwNzM1Mzg2NzM@._V1_UX67_CR0,0,67,98_AL_.jpg",2021-12-16T06:03:30.283081+00:00,0,0,0,0,0,0,0,0,0,0,1,0,0,1,1,0,0,0,0,0,0,[Toy Story 4 (2019)](https://www.imdb.com//title/tt1979376/),"Animation Adventure ComedyWhen a new toy called ""Forky"" joins Woody and the gang, a road trip alongside old and new friends reveals how big the world can be for a toy.Tom Hanks Tim Allen Annie Potts Tony HaleJosh Cooley"
770,Captain America: The Winter Soldier (2014),Captain America: The Winter Soldier,2014,7.7,789236,Action Adventure Sci-Fi,Anthony Russo,Joe Russo Chris Evans Samuel L. Jackson Scarlett Johansson Robert Redford,136,"As Steve Rogers struggles to embrace his role in the modern world, he teams up with a fellow Avenger and S.H.I.E.L.D agent, Black Widow, to battle a new threat from history: an assassin known as the Winter Soldier.",https://www.imdb.com//title/tt1843866/,"https://m.media-amazon.com/images/M/MV5BMzA2NDkwODAwM15BMl5BanBnXkFtZTgwODk5MTgzMTE@._V1_UY98_CR0,0,67,98_AL_.jpg",2021-12-16T06:03:30.283081+00:00,0,0,0,0,0,0,1,1,0,0,1,0,0,0,0,0,0,0,0,0,0,[Captain America: The Winter Soldier (2014)](https://www.imdb.com//title/tt1843866/),"Action Adventure Sci-FiAs Steve Rogers struggles to embrace his role in the modern world, he teams up with a fellow Avenger and S.H.I.E.L.D agent, Black Widow, to battle a new threat from history: an assassin known as the Winter Soldier.Joe Russo Chris Evans Samuel L. Jackson Scarlett Johansson Robert RedfordAnthony Russo"
771,Rockstar (2011),Rockstar,2011,7.7,42569,Drama Music Romance,Imtiaz Ali,Ranbir Kapoor Nargis Fakhri Shammi Kapoor Kumud Mishra,159,"Janardhan Jakhar chases his dreams of becoming a big Rock star, during which he falls in love with Heer.",https://www.imdb.com//title/tt1839596/,"https://m.media-amazon.com/images/M/MV5BOTc3NzAxMjg4M15BMl5BanBnXkFtZTcwMDc2ODQwNw@@._V1_UY98_CR3,0,67,98_AL_.jpg",2021-12-16T06:03:30.283081+00:00,0,0,0,1,0,0,0,0,0,0,0,0,0,0,0,1,0,0,0,0,1,[Rockstar (2011)](https://www.imdb.com//title/tt1839596/),"Drama Music RomanceJanardhan Jakhar chases his dreams of becoming a big Rock star, during which he falls in love with Heer.Ranbir Kapoor Nargis Fakhri Shammi Kapoor Kumud MishraImtiaz Ali"
772,Nebraska (2013),Nebraska,2013,7.7,115939,Adventure Comedy Drama,Alexander Payne,Bruce Dern Will Forte June Squibb Bob Odenkirk,115,"An aging, booze-addled father makes the trip from Montana to Nebraska with his estranged son in order to claim a million-dollar Mega Sweepstakes Marketing prize.",https://www.imdb.com//title/tt1821549/,"https://m.media-amazon.com/images/M/MV5BOGQzODdlMDktNzU4ZC00N2M3LWFkYTAtYTM1NTE0ZWI5YTg4XkEyXkFqcGdeQXVyMTA1NTM1NDI2._V1_UX67_CR0,0,67,98_AL_.jpg",2021-12-16T06:03:30.283081+00:00,0,0,0,0,0,0,0,0,0,0,1,0,0,0,1,1,0,0,0,0,0,[Nebraska (2013)](https://www.imdb.com//title/tt1821549/),"Adventure Comedy DramaAn aging, booze-addled father makes the trip from Montana to Nebraska with his estranged son in order to claim a million-dollar Mega Sweepstakes Marketing prize.Bruce Dern Will Forte June Squibb Bob OdenkirkAlexander Payne"
773,Wreck-It Ralph (2012),Wreck-It Ralph,2012,7.7,400658,Animation Adventure Comedy,Rich Moore,John C. Reilly Jack McBrayer Jane Lynch Sarah Silverman,101,"A video game villain wants to be a hero and sets out to fulfill his dream, but his quest brings havoc to the whole arcade where he lives.",https://www.imdb.com//title/tt1772341/,"https://m.media-amazon.com/images/M/MV5BNzMxNTExOTkyMF5BMl5BanBnXkFtZTcwMzEyNDc0OA@@._V1_UX67_CR0,0,67,98_AL_.jpg",2021-12-16T06:03:30.283081+00:00,0,0,0,0,0,0,0,0,0,0,1,0,0,1,1,0,0,0,0,0,0,[Wreck-It Ralph (2012)](https://www.imdb.com//title/tt1772341/),"Animation Adventure ComedyA video game villain wants to be a hero and sets out to fulfill his dream, but his quest brings havoc to the whole arcade where he lives.John C. Reilly Jack McBrayer Jane Lynch Sarah SilvermanRich Moore"
774,The Little Prince (2015),The Little Prince,2015,7.7,59946,Animation Adventure Drama,Mark Osborne,Jeff Bridges Mackenzie Foy Rachel McAdams Marion Cotillard,108,"A little girl lives in a very grown-up world with her mother, who tries to prepare her for it. Her neighbor, the Aviator, introduces the girl to an extraordinary world where anything is possible, the world of the Little Prince.",https://www.imdb.com//title/tt1754656/,"https://m.media-amazon.com/images/M/MV5BNjg0OTM5OTQyNV5BMl5BanBnXkFtZTgwNDg5NDQ0NTE@._V1_UY98_CR2,0,67,98_AL_.jpg",2021-12-16T06:03:30.283081+00:00,0,0,0,0,0,0,0,0,0,0,1,0,0,1,0,1,0,0,0,0,0,[The Little Prince (2015)](https://www.imdb.com//title/tt1754656/),"Animation Adventure DramaA little girl lives in a very grown-up world with her mother, who tries to prepare her for it. Her neighbor, the Aviator, introduces the girl to an extraordinary world where anything is possible, the world of the Little Prince.Jeff Bridges Mackenzie Foy Rachel McAdams Marion CotillardMark Osborne"
775,Detachment (2011),Detachment,2011,7.7,81730,Drama,Tony Kaye,Adrien Brody Christina Hendricks Marcia Gay Harden Lucy Liu,98,A substitute teacher who drifts from classroom to classroom finds a connection to the students and teachers during his latest assignment.,https://www.imdb.com//title/tt1683526/,"https://m.media-amazon.com/images/M/MV5BMTM3NzQzMDA5Ml5BMl5BanBnXkFtZTcwODA5NTcyNw@@._V1_UY98_CR0,0,67,98_AL_.jpg",2021-12-16T06:03:30.283081+00:00,0,0,0,0,0,0,0,0,0,0,0,0,0,0,0,1,0,0,0,0,0,[Detachment (2011)](https://www.imdb.com//title/tt1683526/),DramaA substitute teacher who drifts from classroom to classroom finds a connection to the students and teachers during his latest assignment.Adrien Brody Christina Hendricks Marcia Gay Harden Lucy LiuTony Kaye
776,Midnight in Paris (2011),Midnight in Paris,2011,7.7,406815,Comedy Fantasy Romance,Woody Allen,Owen Wilson Rachel McAdams Kathy Bates Kurt Fuller,94,"While on a trip to Paris with his fiancée's family, a nostalgic screenwriter finds himself mysteriously going back to the 1920s every day at midnight.",https://www.imdb.com//title/tt1605783/,"https://m.media-amazon.com/images/M/MV5BMTM4NjY1MDQwMl5BMl5BanBnXkFtZTcwNTI3Njg3NA@@._V1_UX67_CR0,0,67,98_AL_.jpg",2021-12-16T06:03:30.283081+00:00,0,1,0,1,0,0,0,0,0,0,0,0,0,0,1,0,0,0,0,0,0,[Midnight in Paris (2011)](https://www.imdb.com//title/tt1605783/),"Comedy Fantasy RomanceWhile on a trip to Paris with his fiancée's family, a nostalgic screenwriter finds himself mysteriously going back to the 1920s every day at midnight.Owen Wilson Rachel McAdams Kathy Bates Kurt FullerWoody Allen"
777,Confessions (2010),Confessions,2010,7.7,37819,Drama Thriller,Tetsuya Nakashima,Takako Matsu Yoshino Kimura Masaki Okada Yukito Nishii,106,A psychological thriller of a grieving mother turned cold-blooded avenger with a twisty master plan to pay back those who were responsible for her daughter's death.,https://www.imdb.com//title/tt1590089/,"https://m.media-amazon.com/images/M/MV5BOGFmODE2YzktMThjNi00MzhjLWI5M2MtYjdhOTc0NDBhMTZkXkEyXkFqcGdeQXVyMTQxNzMzNDI@._V1_UY98_CR1,0,67,98_AL_.jpg",2021-12-16T06:03:30.283081+00:00,0,0,0,0,0,0,0,0,0,0,0,0,0,0,0,1,1,0,0,0,0,[Confessions (2010)](https://www.imdb.com//title/tt1590089/),Drama ThrillerA psychological thriller of a grieving mother turned cold-blooded avenger with a twisty master plan to pay back those who were responsible for her daughter's death.Takako Matsu Yoshino Kimura Masaki Okada Yukito NishiiTetsuya Nakashima
778,The Lego Movie (2014),The Lego Movie,2014,7.7,338258,Animation Action Adventure,Christopher Miller,Phil Lord Chris Pratt Will Ferrell Elizabeth Banks Will Arnett,100,"An ordinary LEGO construction worker, thought to be the prophesied as ""special"", is recruited to join a quest to stop an evil tyrant from gluing the LEGO universe into eternal stasis.",https://www.imdb.com//title/tt1490017/,"https://m.media-amazon.com/images/M/MV5BMTg4MDk1ODExN15BMl5BanBnXkFtZTgwNzIyNjg3MDE@._V1_UX67_CR0,0,67,98_AL_.jpg",2021-12-16T06:03:30.283081+00:00,0,0,0,0,0,0,0,1,0,0,1,0,0,1,0,0,0,0,0,0,0,[The Lego Movie (2014)](https://www.imdb.com//title/tt1490017/),"Animation Action AdventureAn ordinary LEGO construction worker, thought to be the prophesied as ""special"", is recruited to join a quest to stop an evil tyrant from gluing the LEGO universe into eternal stasis.Phil Lord Chris Pratt Will Ferrell Elizabeth Banks Will ArnettChristopher Miller"
779,Gravity (2013),Gravity,2013,7.7,798201,Action Drama Sci-Fi,Alfonso Cuarón,Sandra Bullock George Clooney Ed Harris Orto Ignatiussen,91,Two astronauts work together to survive after an accident leaves them stranded in space.,https://www.imdb.com//title/tt1454468/,"https://m.media-amazon.com/images/M/MV5BNjE5MzYwMzYxMF5BMl5BanBnXkFtZTcwOTk4MTk0OQ@@._V1_UX67_CR0,0,67,98_AL_.jpg",2021-12-16T06:03:30.283081+00:00,0,0,0,0,0,0,1,1,0,0,0,0,0,0,0,1,0,0,0,0,0,[Gravity (2013)](https://www.imdb.com//title/tt1454468/),Action Drama Sci-FiTwo astronauts work together to survive after an accident leaves them stranded in space.Sandra Bullock George Clooney Ed Harris Orto IgnatiussenAlfonso Cuarón
780,Star Trek Into Darkness (2013),Star Trek Into Darkness,2013,7.7,474717,Action Adventure Sci-Fi,J.J. Abrams,Chris Pine Zachary Quinto Zoe Saldana Benedict Cumberbatch,132,"After the crew of the Enterprise find an unstoppable force of terror from within their own organization, Captain Kirk leads a manhunt to a war-zone world to capture a one-man weapon of mass destruction.",https://www.imdb.com//title/tt1408101/,"https://m.media-amazon.com/images/M/MV5BMTk2NzczOTgxNF5BMl5BanBnXkFtZTcwODQ5ODczOQ@@._V1_UX67_CR0,0,67,98_AL_.jpg",2021-12-16T06:03:30.283081+00:00,0,0,0,0,0,0,1,1,0,0,1,0,0,0,0,0,0,0,0,0,0,[Star Trek Into Darkness (2013)](https://www.imdb.com//title/tt1408101/),"Action Adventure Sci-FiAfter the crew of the Enterprise find an unstoppable force of terror from within their own organization, Captain Kirk leads a manhunt to a war-zone world to capture a one-man weapon of mass destruction.Chris Pine Zachary Quinto Zoe Saldana Benedict CumberbatchJ.J. Abrams"
